{
  "schema": "slicesoft.rip.settings.3",
  "autoAfterSlice": false,
  "renderIntent": 0,
  "transparentMode": 0,
  "ripMode": 0,
  "colorMode": 0,
  "inputIcc": "CmykFiles/CIERGB.icc",
  "outputIcc": "CmykFiles/CMYK.icc",
  "continueOnError": false,
  "deviceGrayBits": 2,
  "timeoutSeconds": 3600,
  "outputValidationMode": "strict_s2",
  "outputDirectoryName": "rip",
  "existingOutputPolicy": "fail_closed"
}
